{
  "schema_version": "compositor-1",
  "timeSec": 3.8,
  "width": 608,
  "height": 1080,
  "clear": {
    "r": 0,
    "g": 0,
    "b": 0,
    "a": 1
  },
  "items": [
    {
      "kind": "layer",
      "id": "video:a",
      "source": "video",
      "blockId": "a",
      "relativeSourceSec": 3.8,
      "transform": {
        "x": 0,
        "y": 0,
        "width": 608,
        "height": 1080
      },
      "opacity": 0.5714285714285716,
      "zIndex": 0
    },
    {
      "kind": "layer",
      "id": "video:b",
      "source": "video",
      "blockId": "b",
      "relativeSourceSec": 0.1499999999999999,
      "transform": {
        "x": 0,
        "y": 0,
        "width": 608,
        "height": 1080
      },
      "opacity": 0.4285714285714283,
      "zIndex": 1
    },
    {
      "kind": "text",
      "id": "free:template:a:headline",
      "source": "free_text",
      "elementId": "template:a:headline",
      "params": {
        "content": "caption-a",
        "color": "#E8C872",
        "fontSize": 4.32,
        "fontFamily": "Noto Sans SC",
        "fontWeight": "bold",
        "fontStyle": "normal",
        "textAlign": "left",
        "textDecoration": "none",
        "letterSpacing": 0,
        "lineHeight": 1.35,
        "background.enabled": false,
        "transform.positionX": -251.0336,
        "transform.positionY": 386.20799999999986,
        "transform.scaleX": 1,
        "transform.scaleY": 1,
        "transform.rotate": 0,
        "opacity": 1,
        "template.role": "headline",
        "template.layout": "cinema",
        "shadow.enabled": true,
        "shadow.color": "rgba(0,0,0,0.55)",
        "shadow.offsetX": 0,
        "shadow.offsetY": 1,
        "shadow.blur": 2,
        "shadow.glowBlur": 12,
        "shadow.glowColor": "rgba(0,0,0,0.35)",
        "outline.enabled": true,
        "outline.color": "rgba(0,0,0,0.25)",
        "outline.width": 1.5
      },
      "opacity": 0.5714285714285716,
      "zIndex": 12
    },
    {
      "kind": "text",
      "id": "free:template:b:headline",
      "source": "free_text",
      "elementId": "template:b:headline",
      "params": {
        "content": "caption-b",
        "color": "#E8C872",
        "fontSize": 4.32,
        "fontFamily": "Noto Sans SC",
        "fontWeight": "bold",
        "fontStyle": "normal",
        "textAlign": "left",
        "textDecoration": "none",
        "letterSpacing": 0,
        "lineHeight": 1.35,
        "background.enabled": false,
        "transform.positionX": -251.0336,
        "transform.positionY": 386.20799999999986,
        "transform.scaleX": 1,
        "transform.scaleY": 1,
        "transform.rotate": 0,
        "opacity": 1,
        "template.role": "headline",
        "template.layout": "cinema",
        "shadow.enabled": true,
        "shadow.color": "rgba(0,0,0,0.55)",
        "shadow.offsetX": 0,
        "shadow.offsetY": 1,
        "shadow.blur": 2,
        "shadow.glowBlur": 12,
        "shadow.glowColor": "rgba(0,0,0,0.35)",
        "outline.enabled": true,
        "outline.color": "rgba(0,0,0,0.25)",
        "outline.width": 1.5
      },
      "opacity": 0.4285714285714283,
      "zIndex": 12
    }
  ],
  "audio": [
    {
      "kind": "clip",
      "blockId": "a",
      "timelineSec": 3.8,
      "volume": 1
    },
    {
      "kind": "clip",
      "blockId": "b",
      "timelineSec": 3.8,
      "volume": 1
    }
  ],
  "transition": {
    "inDissolve": true,
    "progress": 0.4285714285714283
  }
}
