{
  "schema_version": "compositor-1",
  "timeSec": 6.65,
  "width": 608,
  "height": 1080,
  "clear": {
    "r": 0,
    "g": 0,
    "b": 0,
    "a": 1
  },
  "items": [
    {
      "kind": "layer",
      "id": "video:b",
      "source": "video",
      "blockId": "b",
      "relativeSourceSec": 3,
      "transform": {
        "x": 0,
        "y": 0,
        "width": 608,
        "height": 1080
      },
      "opacity": 1,
      "zIndex": 0
    },
    {
      "kind": "text",
      "id": "free:template:b:headline",
      "source": "free_text",
      "elementId": "template:b:headline",
      "params": {
        "content": "caption-b",
        "color": "#E8C872",
        "fontSize": 4.32,
        "fontFamily": "Noto Sans SC",
        "fontWeight": "bold",
        "fontStyle": "normal",
        "textAlign": "left",
        "textDecoration": "none",
        "letterSpacing": 0,
        "lineHeight": 1.35,
        "background.enabled": false,
        "transform.positionX": -251.0336,
        "transform.positionY": 386.20799999999986,
        "transform.scaleX": 1,
        "transform.scaleY": 1,
        "transform.rotate": 0,
        "opacity": 1,
        "template.role": "headline",
        "template.layout": "cinema"
      },
      "opacity": 1,
      "zIndex": 11
    }
  ],
  "audio": [
    {
      "kind": "clip",
      "blockId": "b",
      "timelineSec": 6.65,
      "volume": 1
    }
  ],
  "transition": {
    "inDissolve": false,
    "progress": null
  }
}
